<?xml version="1.0" encoding="UTF-8"?>
<schema xmlns="http://www.w3.org/2001/XMLSchema" targetNamespace="http://www.example.org/user" xmlns:tns="http://www.example.org/user" elementFormDefault="qualified">

    <element name="firstName" type="string"></element>

    <element name="lastName" type="string"></element>

    <element name="userName" type="string"></element>

    <element name="password" type="string"></element>

    <element name="permission" type="int"></element>
    

    <complexType name="users">
    	<sequence>
    		<element name="user" type="tns:user" maxOccurs="unbounded" minOccurs="1"></element>
    	</sequence>
    </complexType>
    
    <complexType name="user">
    	<sequence>
    		<element ref="tns:firstName"></element>
    		<element ref="tns:lastName"></element>
    		<element ref="tns:userName"></element>
    		<element ref="tns:password"></element>
    		<element ref="tns:permission"></element>
    	</sequence>
    </complexType>


    <element name="users" type="tns:users"></element>
</schema>