<?xml version="1.0" encoding="UTF-8"?>
<tns:users xmlns:tns="http://www.example.org/user"
    xmlns:xsi="http://www.w3.org/2001/XMLSchema-instance" xsi:schemaLocation="http://www.example.org/user user.xsd ">
    <tns:user>
        <tns:firstName>Michael</tns:firstName>
        <tns:lastName>Bieniek</tns:lastName>
        <tns:userName>mbieniek</tns:userName>
        <tns:password>kartofel</tns:password>
        <tns:permission>1</tns:permission>
    </tns:user>
    <tns:user>
        <tns:firstName>James</tns:firstName>
        <tns:lastName>Thomson</tns:lastName>
        <tns:userName>jomsie</tns:userName>
        <tns:password>test</tns:password>
        <tns:permission>0</tns:permission>
    </tns:user>
    <tns:user>
        <tns:firstName>Andrei</tns:firstName>
        <tns:lastName>Tulai</tns:lastName>
        <tns:userName>atulai</tns:userName>
        <tns:password>test</tns:password>
        <tns:permission>0</tns:permission>
    </tns:user>
</tns:users>
